{
  "schemaVersion": 1,
  "project": "woo-ops-saas",
  "statuses": ["planned", "in-progress", "blocked", "failed", "completed"],
  "tasks": [
    {
      "id": "T0003",
      "epic": "E00",
      "title": "Repair Agentpack Windows worktree recovery",
      "type": "fix",
      "phase": 0,
      "priority": "P0",
      "estimate": "S",
      "parallelGroup": "agentpack",
      "dependencies": [],
      "references": [
        "AGENTS.md",
        ".agentpack/tasks/README.md",
        ".agentpack/workflows/worktrees.md",
        ".agentpack/scripts/agentpack.mjs",
        ".agentpack/scripts/worktree.mjs"
      ],
      "scope": [
        "Normalize Git worktree paths before matching registered worktrees",
        "Cover failed-task resume and unregistered-path rejection with deterministic tests"
      ],
      "acceptance": [
        "A registered Windows worktree can be resumed regardless of slash style or case",
        "An existing but unregistered path is still rejected",
        "Task state and lock behavior remain unchanged"
      ],
      "validation": [
        "node --test .agentpack/scripts/worktree.test.mjs",
        "node .agentpack/scripts/agentpack.mjs validate"
      ]
    },
    {
      "id": "T0001",
      "epic": "E00",
      "title": "Rebase strict TypeScript monorepo for SQLite and Hostinger",
      "type": "chore",
      "phase": 0,
      "priority": "P0",
      "estimate": "M",
      "parallelGroup": "foundation",
      "dependencies": [],
      "references": [
        "AGENTS.md",
        ".agentpack/architecture/ARCHITECTURE.md",
        ".agentpack/architecture/adr/ADR-001-database.md"
      ],
      "scope": [
        "Create Vite web, Express API and shared package shells",
        "Configure strict TypeScript, formatting, linting and root scripts",
        "Establish SQLite-file and single-process deployment metadata"
      ],
      "acceptance": [
        "Workspace packages build production entry points",
        "Root format, typecheck and build commands pass",
        "Connector boundaries expose no remote mutation methods"
      ],
      "validation": [
        "npm ci",
        "npm run format:check",
        "npm run typecheck",
        "npm run build",
        "node .agentpack/scripts/agentpack.mjs validate"
      ]
    },
    {
      "id": "T0002",
      "epic": "E00",
      "title": "Add CI gates and Hostinger deployment checks",
      "type": "ops",
      "phase": 0,
      "priority": "P0",
      "estimate": "M",
      "parallelGroup": "foundation",
      "dependencies": ["T0001"],
      "references": [".agentpack/architecture/DEPLOYMENT.md", ".agentpack/architecture/TESTING.md"],
      "scope": [
        "Add CI for validation, install, typecheck, tests and build",
        "Add Node start, health and environment documentation",
        "Add safe data-directory and secret checks"
      ],
      "acceptance": [
        "CI has least-privilege gates",
        "Hostinger smoke command is documented",
        "Private data files are not served"
      ],
      "validation": ["npm run lint", "npm run typecheck", "npm run build"]
    },
    {
      "id": "T0101",
      "epic": "E01",
      "title": "Implement SQLite migrations and repository foundation",
      "type": "feat",
      "phase": 1,
      "priority": "P0",
      "estimate": "L",
      "parallelGroup": "persistence",
      "dependencies": ["T0001"],
      "references": [
        ".agentpack/architecture/ARCHITECTURE.md",
        ".agentpack/architecture/DATA_MODEL.md",
        ".agentpack/architecture/adr/ADR-001-database.md"
      ],
      "scope": [
        "Add versioned migrations for account, sessions, connections, orders and jobs",
        "Add WAL, foreign keys, busy timeout and transaction helpers",
        "Add repository ports requiring authenticated account context"
      ],
      "acceptance": [
        "Fresh and repeated migrations are safe",
        "SQLite constraints and indexes are tested",
        "Repository calls cannot use client account authority"
      ],
      "validation": [
        "npm run test:unit -- --filter persistence",
        "npm run test:integration -- --filter sqlite"
      ]
    },
    {
      "id": "T0102",
      "epic": "E01",
      "title": "Implement secure local authentication and sessions",
      "type": "security",
      "phase": 1,
      "priority": "P0",
      "estimate": "L",
      "parallelGroup": "identity",
      "dependencies": ["T0101"],
      "references": [
        ".agentpack/product/PRD.md",
        ".agentpack/architecture/SECURITY.md",
        ".agentpack/architecture/API.md"
      ],
      "scope": [
        "Implement registration, login, logout, session rotation and revocation",
        "Hash passwords and session tokens",
        "Add CSRF, origin checks, rate limits and safe errors"
      ],
      "acceptance": [
        "Credentials and sessions are never stored plaintext",
        "Invalid login does not reveal account state",
        "Privilege/password changes revoke sessions"
      ],
      "validation": [
        "npm run test:unit -- --filter auth",
        "npm run test:integration -- --filter sessions",
        "npm run test:security -- --filter auth"
      ]
    },
    {
      "id": "T0103",
      "epic": "E01",
      "title": "Add account roles, settings and audit events",
      "type": "feat",
      "phase": 1,
      "priority": "P0",
      "estimate": "L",
      "parallelGroup": "identity",
      "dependencies": ["T0102"],
      "references": [".agentpack/product/PRD.md", ".agentpack/architecture/SECURITY.md"],
      "scope": [
        "Add owner/admin/operator/viewer permissions",
        "Add locale, timezone, currency and document identity settings",
        "Add append-only redacted audit persistence and API"
      ],
      "acceptance": [
        "Every protected use case checks a capability",
        "Sensitive actions produce audit events",
        "Account switching/authority cannot come from request body"
      ],
      "validation": [
        "npm run test:unit -- --filter permissions",
        "npm run test:integration -- --filter audit",
        "npm run test:security -- --filter privilege"
      ]
    },
    {
      "id": "T0201",
      "epic": "E02",
      "title": "Build read-only connector SDK and Woo authorization",
      "type": "feat",
      "phase": 2,
      "priority": "P0",
      "estimate": "XL",
      "parallelGroup": "connector",
      "dependencies": ["T0103"],
      "references": [
        ".agentpack/architecture/SYNC_AND_CONNECTORS.md",
        ".agentpack/architecture/adr/ADR-002-read-only-connectors.md"
      ],
      "scope": [
        "Implement capability-based pull, health, authorization and webhook ports",
        "Implement Woo REST v3 read-scope onboarding",
        "Encrypt credentials and protect callback state and outbound URLs"
      ],
      "acceptance": [
        "No connector mutation method or HTTP escape hatch exists",
        "Credentials never enter logs/jobs/responses",
        "Callback replay, mismatch and SSRF tests pass"
      ],
      "validation": [
        "npm run test:unit -- --filter connectors",
        "npm run test:contract -- --filter woo-auth",
        "npm run test:security -- --filter callbacks"
      ]
    },
    {
      "id": "T0202",
      "epic": "E02",
      "title": "Implement durable SQLite jobs and webhook inbox",
      "type": "feat",
      "phase": 2,
      "priority": "P0",
      "estimate": "L",
      "parallelGroup": "jobs",
      "dependencies": ["T0101", "T0201"],
      "references": [
        ".agentpack/architecture/ARCHITECTURE.md",
        ".agentpack/architecture/SYNC_AND_CONNECTORS.md"
      ],
      "scope": [
        "Add queued/running/succeeded/failed/dead-letter states",
        "Add lease, retry, idempotency, progress and cancellation",
        "Persist raw webhook checksum/inbox before bounded processing"
      ],
      "acceptance": [
        "Restart and duplicate delivery do not duplicate effects",
        "Poison jobs become visible dead letters",
        "Job payloads are small and schema validated"
      ],
      "validation": [
        "npm run test:unit -- --filter jobs",
        "npm run test:integration -- --filter job-runner",
        "npm run test:chaos -- --filter restart"
      ]
    },
    {
      "id": "T0203",
      "epic": "E02",
      "title": "Sync Woo catalog products and taxonomies",
      "type": "feat",
      "phase": 2,
      "priority": "P0",
      "estimate": "L",
      "parallelGroup": "woocommerce",
      "dependencies": ["T0202"],
      "references": [
        ".agentpack/architecture/SYNC_AND_CONNECTORS.md",
        ".agentpack/architecture/DATA_MODEL.md"
      ],
      "scope": [
        "Pull products, variations, categories, tags and shipping classes",
        "Normalize snapshots and resumable cursors",
        "Record remote deletion markers and sync health"
      ],
      "acceptance": [
        "Interrupted catalog sync resumes without duplicates",
        "Variation/category identity is deterministic",
        "Rate and schema failures are observable"
      ],
      "validation": [
        "npm run test:contract -- --filter woo-products",
        "npm run test:integration -- --filter catalog-sync"
      ]
    },
    {
      "id": "T0204",
      "epic": "E02",
      "title": "Sync and normalize Woo orders refunds and webhooks",
      "type": "feat",
      "phase": 2,
      "priority": "P0",
      "estimate": "XL",
      "parallelGroup": "woocommerce",
      "dependencies": ["T0203"],
      "references": [
        ".agentpack/product/PRD.md",
        ".agentpack/architecture/SYNC_AND_CONNECTORS.md",
        ".agentpack/architecture/DATA_MODEL.md"
      ],
      "scope": [
        "Import orders/refunds through polling and verified webhooks",
        "Normalize money, dates, addresses, lines and source metadata",
        "Merge remote-owned paths without overwriting local workflow/export history"
      ],